{
  "schema_version": "cell_runtime_changelog.v1",
  "cell_id": "hail_solar",
  "current_pin": "hail_solar@model_v1_0__docs_r7",
  "entries": [
    {
      "consumer_pin": "hail_solar@model_v1_0__docs_r8",
      "published_on": "2026-07-20",
      "semantic_damage_model_version": "model v1.0",
      "documentation_revision": "docs r8",
      "artifact_schema_version": null,
      "capability_schema_version": null,
      "artifact_path": null,
      "runtime_behavior_changed": false,
      "contract_changed": false,
      "summary": "Adds the complete cell-owned three-file basics set: first-reader hail/MESH terminology and examples, the evidence-to-SHIP reasoning chain, and an exact reference for logistic archetypes, stow conditioning, exposure, value profiles, capabilities, and known-answer tests.",
      "consumer_action": "No runtime action. Continue to pin model v1.0/docs r7/bundle v2 and its recorded SHA. Treat worked inputs as class-template examples, not site observations."
    },
    {
      "consumer_pin": "hail_solar@model_v1_0__docs_r7",
      "published_on": "2026-07-10",
      "semantic_damage_model_version": "model v1.0",
      "documentation_revision": "docs r7",
      "artifact_schema_version": "damage_curve_record_bundle.v2",
      "capability_schema_version": "capability_declaration.v2",
      "artifact_path": "docs/cells/hail_solar/current/hail_solar__model_v1_0__docs_r7__curve_artifact.json",
      "runtime_behavior_changed": false,
      "contract_changed": true,
      "summary": "Publishes explicit value profiles and denominators, strict logistic payload validation, known-answer tests, normalized self-references, and consumer-scoped tail capability semantics. D50, k, max_DR, selectors, and conditioner formulas are unchanged.",
      "consumer_action": "Pin model v1.0 + docs r7 + artifact schema v2 + SHA-256; select a named value profile or provide a site-specific value basis; run the known-answer tests."
    },
    {
      "consumer_pin": "hail_solar@model_v1_0__docs_r6",
      "published_on": "2026-07-10",
      "semantic_damage_model_version": "model v1.0",
      "documentation_revision": "docs r6",
      "artifact_schema_version": null,
      "capability_schema_version": null,
      "artifact_path": null,
      "runtime_behavior_changed": false,
      "contract_changed": false,
      "summary": "Evidence-only wind-driven hail and stow-interaction caveat; no runtime artifact was published at docs r6.",
      "consumer_action": "No runtime change."
    },
    {
      "consumer_pin": "hail_solar@model_v1_0__docs_r5",
      "published_on": "2026-07-06",
      "semantic_damage_model_version": "model v1.0",
      "documentation_revision": "docs r5",
      "artifact_schema_version": "damage_curve_record_bundle.v1",
      "capability_schema_version": "capability_declaration.v1",
      "artifact_path": null,
      "runtime_behavior_changed": false,
      "contract_changed": true,
      "summary": "First v2.5 machine-readable hail artifact; carried logistic curves but no serialized value profile or runtime KAT file.",
      "consumer_action": "Superseded for repository-current consumption by docs r7; preserved in the raw v2.5 source drop and Git history."
    }
  ]
}
