{
  "schema_version": "cell_runtime_changelog.v1",
  "cell_id": "hail_real_estate",
  "current_pin": "hail_real_estate@model_v1_0__docs_r1",
  "entries": [
    {
      "consumer_pin": "hail_real_estate@model_v1_0__docs_r1",
      "semantic_damage_model_version": "model v1.0",
      "documentation_revision": "docs r1",
      "artifact_schema_version": "damage_curve_record_bundle.v3",
      "capability_schema_version": "capability_declaration.v3",
      "published_on": "2026-10-26",
      "artifact_path": "docs/cells/hail_real_estate/current/hail_real_estate__model_v1_0__docs_r1__curve_artifact.json",
      "runtime_behavior_changed": true,
      "contract_changed": false,
      "summary": "First canonical screening admission of unchanged three-profile material roof and conditional walls/windows responses. Exact own-unit shares and explicit acknowledgement; remainder and equipment withheld.",
      "consumer_action": "Exact pin and unit-value bindings; qualify current curated point exposure, severe-event frequency, joint event marks, separate unit caps, original missing mass and annual metrics before national delivery."
    }
  ]
}
