{
  "schema_version": "cell_runtime_changelog.v1",
  "cell_id": "wildfire_solar",
  "current_pin": "wildfire_solar@model_v1_0__docs_r3",
  "entries": [
    {
      "consumer_pin": "wildfire_solar@model_v1_0__docs_r4",
      "published_on": "2026-07-20",
      "semantic_damage_model_version": "model v1.0",
      "documentation_revision": "docs r4",
      "artifact_schema_version": null,
      "capability_schema_version": null,
      "artifact_path": null,
      "runtime_behavior_changed": false,
      "contract_changed": false,
      "summary": "Adds the complete cell-owned three-file basics set: first-reader FSim flame-length-class terminology, the evidence-to-SHIP reasoning chain, and an exact reference for ten categorical state tables, value linkage, screening limitations, capabilities, and known-answer tests.",
      "consumer_action": "No runtime action. Continue to pin model v1.0/docs r3/bundle v2 and its recorded SHA. Preserve screening/not-calibrated flags and do not infer continuous flame physics between source-native classes."
    },
    {
      "consumer_pin": "wildfire_solar@model_v1_0__docs_r3",
      "published_on": "2026-07-10",
      "semantic_damage_model_version": "model v1.0",
      "documentation_revision": "docs r3",
      "artifact_schema_version": "damage_curve_record_bundle.v2",
      "capability_schema_version": "capability_declaration.v2",
      "artifact_path": "docs/cells/wildfire_solar/current/wildfire_solar__model_v1_0__docs_r3__curve_artifact.json",
      "runtime_behavior_changed": true,
      "contract_changed": true,
      "summary": "Promotes the v0.1 no-curve scaffold to the first screening-grade runtime model with exact FSim-class state tables, ten failure units, explicit value linkage, and executable known-answer tests.",
      "consumer_action": "Replace any legacy continuous FLI logistic proxy with the pinned exact-state artifact; carry screening/not-calibrated flags and validate the KATs."
    },
    {
      "consumer_pin": "wildfire_solar@model_v0_1__docs_r2",
      "published_on": "2026-07-10",
      "semantic_damage_model_version": "model v0.1",
      "documentation_revision": "docs r2",
      "artifact_schema_version": "damage_curve_record_bundle.v1",
      "capability_schema_version": "capability_declaration.v1",
      "artifact_path": null,
      "runtime_behavior_changed": false,
      "contract_changed": false,
      "summary": "Pressure-tested research scaffold with zero runtime curves and NO_RUNTIME_CURVE.",
      "consumer_action": "Superseded for runtime by model v1.0; retain for evidence, rejection, and promotion-audit history."
    }
  ]
}
