{
  "schema_version": "cell_runtime_changelog.v1",
  "cell_id": "wildfire_wind",
  "current_pin": "wildfire_wind@model_v1_0__docs_r1",
  "entries": [
    {
      "consumer_pin": "wildfire_wind@model_v1_0__docs_r1",
      "published_on": "2026-08-08",
      "semantic_damage_model_version": "model v1.0",
      "documentation_revision": "docs r1",
      "artifact_schema_version": "damage_curve_record_bundle.v3",
      "capability_schema_version": "capability_declaration.v3",
      "artifact_path": "docs/cells/wildfire_wind/current/wildfire_wind__model_v1_0__docs_r1__curve_artifact.json",
      "runtime_behavior_changed": true,
      "contract_changed": true,
      "summary": "First canonical partial-screening release: two Tier-4 source-native FSim-class curves for pad electrical and shared GSU protection-control-DC units; every other unit remains withheld.",
      "consumer_action": "Pin model v1.0/docs r1/bundle v3 and the index SHA; run KATs; pass the exact FSim product and assumption-set IDs; bind only same-unit value/exposure; label outputs partial Tier-4 screening."
    }
  ]
}
