{
  "schema_version": "cell_runtime_changelog.v1",
  "cell_id": "convective_wind_real_estate",
  "current_pin": "convective_wind_real_estate@model_v1_0__docs_r1",
  "entries": [
    {
      "consumer_pin": "convective_wind_real_estate@model_v1_0__docs_r1",
      "semantic_damage_model_version": "model v1.0",
      "documentation_revision": "docs r1",
      "artifact_schema_version": "damage_curve_record_bundle.v3",
      "capability_schema_version": "capability_declaration.v3",
      "published_on": "2026-10-26",
      "artifact_path": "docs/cells/convective_wind_real_estate/current/convective_wind_real_estate__model_v1_0__docs_r1__curve_artifact.json",
      "runtime_behavior_changed": true,
      "contract_changed": false,
      "summary": "First canonical screening admission for the three r1 references. Unchanged source EF/Hazus-cost arrays; separate straight-line and direct-hit tornado pathways. Explicit same-building RCN bindings; contents withheld.",
      "consumer_action": "Migrate only by exact pin; verify ASCE/SPC support, own-footprint direct hit, original population weights, capped annual distributions and no cross-hazard Total. Source DR admission does not establish annual qualification."
    }
  ]
}
