{
  "schema_version": "cell_runtime_changelog.v1",
  "cell_id": "tropical_cyclone_wind_wind",
  "current_pin": "tropical_cyclone_wind_wind@model_v1_2__docs_r2",
  "entries": [
    {
      "consumer_pin": "tropical_cyclone_wind_wind@model_v1_2__docs_r2",
      "published_on": "2026-08-14",
      "semantic_damage_model_version": "model v1.2",
      "documentation_revision": "docs r2",
      "artifact_schema_version": "damage_curve_record_bundle.v3",
      "capability_schema_version": "capability_declaration.v3",
      "artifact_path": "docs/cells/tropical_cyclone_wind_wind/current/tropical_cyclone_wind_wind__model_v1_2__docs_r2__curve_artifact.json",
      "runtime_behavior_changed": true,
      "contract_changed": true,
      "summary": "Keeps the Jaimes 3.3 MW curve unchanged and corrects the canonical proxy from a 0.63 equipment-assembly value scope to the source-aligned 0.16 tower-only value scope; 0.84 remains withheld.",
      "consumer_action": "Pin model v1.2/docs r2/bundle v3 and the index SHA; use the exact tower failure unit, proxy policy, asset profile and value-basis IDs; enforce 0.16 occurrence and annual caps; reject the model-v1.1 63% route."
    },
    {
      "consumer_pin": "tropical_cyclone_wind_wind@model_v1_1__docs_r1",
      "published_on": "2026-08-14",
      "semantic_damage_model_version": "model v1.1",
      "documentation_revision": "docs r1",
      "artifact_schema_version": "damage_curve_record_bundle.v3",
      "capability_schema_version": "capability_declaration.v3",
      "artifact_path": "docs/cells/tropical_cyclone_wind_wind/archive/model_v1_1__docs_r1/tropical_cyclone_wind_wind__model_v1_1__docs_r1__curve_artifact.json",
      "runtime_behavior_changed": true,
      "contract_changed": true,
      "summary": "Adds one exact owner-approved canonical-5-MW screening proxy using unchanged Jaimes 3.3 MW parameters, a proxy-only complete speed boundary, and a 0.63 rotor+nacelle+tower covered-value contract; model-v1.0 source selectors reproduce exactly.",
      "consumer_action": "Pin model v1.1/docs r1/bundle v3 and the index SHA; require the exact proxy policy, shared Wind Farm profile and covered-value IDs; enforce the 0.63 occurrence and annual cap; disclose 0.37 of project TIV as withheld; never infer a generic nearest turbine selector."
    },
    {
      "consumer_pin": "tropical_cyclone_wind_wind@model_v1_0__docs_r1",
      "published_on": "2026-08-09",
      "semantic_damage_model_version": "model v1.0",
      "documentation_revision": "docs r1",
      "artifact_schema_version": "damage_curve_record_bundle.v3",
      "capability_schema_version": "capability_declaration.v3",
      "artifact_path": "docs/cells/tropical_cyclone_wind_wind/archive/model_v1_0__docs_r1/tropical_cyclone_wind_wind__model_v1_0__docs_r1__curve_artifact.json",
      "runtime_behavior_changed": true,
      "contract_changed": true,
      "summary": "First canonical partial-screening release: three exact Jaimes expected-damage curves for one quarantined source-native turbine/tower exposure unit; every standard turbine and wind-farm unit remains withheld.",
      "consumer_action": "Pin model v1.0/docs r1/bundle v3 and the index SHA; run all 47 KATs; supply the exact pathway, source-native 10 m 3-second gust, turbine archetype, and source assumption acknowledgement; do not bind dollars or whole-farm/annual metrics."
    }
  ]
}
