{
  "schema_version": "cell_runtime_changelog.v1",
  "cell_id": "wildfire_real_estate",
  "current_pin": "wildfire_real_estate@model_v1_0__docs_r1",
  "entries": [
    {
      "consumer_pin": "wildfire_real_estate@model_v1_0__docs_r1",
      "semantic_damage_model_version": "model v1.0",
      "documentation_revision": "docs r1",
      "artifact_schema_version": "damage_curve_record_bundle.v3",
      "capability_schema_version": "capability_declaration.v3",
      "published_on": "2026-10-26",
      "artifact_path": "docs/cells/wildfire_real_estate/current/wildfire_real_estate__model_v1_0__docs_r1__curve_artifact.json",
      "runtime_behavior_changed": true,
      "contract_changed": false,
      "summary": "Unchanged three-profile class tables admitted only for explicit potential-structure screening; developed-building exposure remains unresolved.",
      "consumer_action": "Pin native source and fixed whole-building RCN; preserve unsupported location mass; qualify annual count/cap/mixture and independent readback."
    }
  ]
}
