{
  "schema_version": "cell_runtime_changelog.v1",
  "cell_id": "tropical_cyclone_wind_real_estate",
  "current_pin": "tropical_cyclone_wind_real_estate@model_v1_0__docs_r1",
  "entries": [
    {
      "consumer_pin": "tropical_cyclone_wind_real_estate@model_v1_0__docs_r1",
      "semantic_damage_model_version": "model v1.0",
      "documentation_revision": "docs r1",
      "artifact_schema_version": "damage_curve_record_bundle.v3",
      "capability_schema_version": "capability_declaration.v3",
      "published_on": "2026-10-26",
      "artifact_path": "docs/cells/tropical_cyclone_wind_real_estate/current/tropical_cyclone_wind_real_estate__model_v1_0__docs_r1__curve_artifact.json",
      "runtime_behavior_changed": true,
      "contract_changed": false,
      "summary": "Unchanged source-native Hazus tables admitted at screening grade for three building bindings and three explicit terrain conditions; remaining terrain/retail records retained as source evidence.",
      "consumer_action": "Pin source/value/terrain and prove current native STORM coupling, annual cap, unavailable tail and readback."
    }
  ]
}
